{
  "$schema": "../../../STANDARD/schemas/broadcast_readable_report_2_0.schema.json",
  "schema_family": "broadcast-readable-report",
  "schema_version": "2.0.0",
  "project_id": "PRJ-006",
  "result": "NEEDS_REVIEW",
  "config_binding": {
    "schema_version": "1.0.0",
    "enabled": true,
    "profile_id": "BROADCAST_READABLE_SCRIPT",
    "profile_version": "2.0.0",
    "sha256": "af27782a4a3e40beed1b483b51873c62f46808fda36ce01d3b019c4e8ff0d4d5"
  },
  "output_profile_binding": {
    "profile_id": "BROADCAST_READABLE_SCRIPT",
    "profile_version": "2.0.0",
    "profile_path": "CHANNELS/mystery_main/output_profiles/broadcast-readable-script/2.0.0.json",
    "schema_path": "STANDARD/schemas/broadcast_readable_output_profile_2_0.schema.json",
    "document_sha256": "79252067a29b8b5f1b3b418bb7682b86e6b9787bc204e6e556ea9b7cb7b7582a",
    "file_sha256": "d156c49f31a0ecee4563c7eb6347ff5973325a918eb1fae3281955a70ec07284"
  },
  "input_artifact_hashes": {
    "broadcast_readable_config": "af27782a4a3e40beed1b483b51873c62f46808fda36ce01d3b019c4e8ff0d4d5",
    "screenplay_units": "7cd312e26e8d7d468cf0b64a1d125317edab7065f7e60ade8b78641c7679a1f5",
    "characters": "c2cfd09e7c613f25b359ce520562ebcc1b30109fcad1db0d63aa7f0c7087c731",
    "relationships": "2ab6624d4badbd114397da5f7cf5fcdc286cc0b9c477faf73b795e57e3f5c09b",
    "panel_cast": "31171e1bebf0cff55dba2433f2d37d564fd735fa39c0d33961e21c060eb4e976",
    "reaction_segments": "2cfd711127fe51fe47405a939b11032fa9bdc9c55c2632a9fb99acb336ab4674",
    "presentation_plan": "16abc7423999281f44ca265208538e5d7aa50272956fea09d67fdf5b5320e225",
    "final_script": "df995516ec1337de81b5b4aebc74cbd2af3c75a7a44393d851e768517749e602"
  },
  "output_artifact_hashes": {
    "canonical_readable_script": "5a901b14502a69bc38f7906dcfc816c383d74501f13c09f2271be94b2bf75d41",
    "expected_production_copy": "5a901b14502a69bc38f7906dcfc816c383d74501f13c09f2271be94b2bf75d41"
  },
  "scene_mappings": [
    {
      "scene_id": "SCN-01",
      "first_global_segment_index": 0,
      "last_global_segment_index": 2,
      "heading_sha256": "9892a7e0eb198994164c9be9239094d9dd6bef1b3da2490f9e7fecf759a78eec",
      "situation_context_sha256": "bc4603c854268d5e6d3c577ee686cd746395bbda4a2ebb35336218f7d6113f82",
      "sound_action_context_sha256": "0908b1c7108cf3061299df17a1740db97006ce0f0ed429463b691e3d04180bd0",
      "retrospective_sha256": null,
      "actual_byte_range": {
        "byte_start": 2720,
        "byte_end": 5674
      }
    },
    {
      "scene_id": "SCN-02",
      "first_global_segment_index": 3,
      "last_global_segment_index": 4,
      "heading_sha256": "148e83648938d006765c72fe42a170effb2b6ae9b4d70e8374d4454253698d34",
      "situation_context_sha256": "283893899090de12d8008f0d04edb679695466d155d6c664d3196d86c7c44119",
      "sound_action_context_sha256": "50a1b6db0250c619b85f14dd2b677b1e2cf301f13b557094a1eab3e1c1013135",
      "retrospective_sha256": null,
      "actual_byte_range": {
        "byte_start": 5676,
        "byte_end": 8197
      }
    },
    {
      "scene_id": "SCN-03",
      "first_global_segment_index": 5,
      "last_global_segment_index": 6,
      "heading_sha256": "2c8f3a08558a5a110fa8b1378fb68db4503d5a54ad9296887893a2a1f01a778c",
      "situation_context_sha256": "026f13691ef2f7713723a3db8484331d0c26096d7febba4f819a3102ca4ffcac",
      "sound_action_context_sha256": "b1612be4d7f5d51ef72b226153fc08f93a2ead6fddec8e238276e4a979fb7352",
      "retrospective_sha256": null,
      "actual_byte_range": {
        "byte_start": 8199,
        "byte_end": 10640
      }
    },
    {
      "scene_id": "SCN-04",
      "first_global_segment_index": 7,
      "last_global_segment_index": 9,
      "heading_sha256": "c000a7149a08de5f7219ae823bed85054cbed366041fc90ee6e0da70189cfa68",
      "situation_context_sha256": "829c8d134bdb9c4b7b57b52f4916fa4f43804607177fc28e869f7d03d4d2297d",
      "sound_action_context_sha256": "dfe7ccdc96a9d3590b846d5999dbeaa5c40aca5f95b2c4293b8fdc0122d446ca",
      "retrospective_sha256": "fb173a022553566eb583c4cb4606cb36fa223c8d27fb0b11a854894f211cd94f",
      "actual_byte_range": {
        "byte_start": 10642,
        "byte_end": 13910
      }
    },
    {
      "scene_id": "SCN-05",
      "first_global_segment_index": 10,
      "last_global_segment_index": 11,
      "heading_sha256": "d079f7019ac2b319f384a89099c690e758a3ee56caf866407d0b4bcdc352e89a",
      "situation_context_sha256": "df8f678bb8b83c3ef96fde1c0a56379ffb32890a80432df06a37cdb438061bc8",
      "sound_action_context_sha256": "df93af2765815ef9f29078fc0624c0ec8c53284be882375640eaaa04d53f532a",
      "retrospective_sha256": "7ceb9cda63e0dc579e2af13ab3480a17f78d72997f09054368b6facffc3b68d6",
      "actual_byte_range": {
        "byte_start": 13912,
        "byte_end": 16677
      }
    },
    {
      "scene_id": "SCN-06",
      "first_global_segment_index": 12,
      "last_global_segment_index": 14,
      "heading_sha256": "3b18341eb5910877f37ab05caae71bd957b97eb670ffae1bbbce5c113c146a27",
      "situation_context_sha256": "bc6f7dd5d5f239db621bb56de610492e3c5484858254910d8504f1884bd675fa",
      "sound_action_context_sha256": "09bc6eec170b99909b2c3ea31aef4f3f5ddc4b301b5c037df1aa1e37c7baa550",
      "retrospective_sha256": "b42817f649a8d6ab443c54113642adf260a8fd89636e7bc8f7119cc87d7452f6",
      "actual_byte_range": {
        "byte_start": 16679,
        "byte_end": 19933
      }
    },
    {
      "scene_id": "SCN-07",
      "first_global_segment_index": 15,
      "last_global_segment_index": 16,
      "heading_sha256": "94baa9140370e1472999332b363f0ab129f76798ecc5edd538f39fa1eff56477",
      "situation_context_sha256": "719985d59766b053b16a8c2e4da9192d6f1aed7d1db2b3f4f517343a5993a2dc",
      "sound_action_context_sha256": "5d7bf95bb9389e6b83ab9ff3cf0abd6cc0775fd1737649a8953dfdeda38a1eaa",
      "retrospective_sha256": "ca51d0b2715abd3717e951969d38d6cbe7dced0be31034fe9eb747da7abe6002",
      "actual_byte_range": {
        "byte_start": 19935,
        "byte_end": 22635
      }
    },
    {
      "scene_id": "SCN-08",
      "first_global_segment_index": 17,
      "last_global_segment_index": 18,
      "heading_sha256": "d862a06d5aab5e7b157764ab554576febab1606d3770d19a1898d597ad6781a1",
      "situation_context_sha256": "b8bb069b8098b84b2e9fc0c7cb5b2a2bc0555c8c902488be8b4583098320aec6",
      "sound_action_context_sha256": "6ce1e1e90965b5bcf04bcf82403dfe2b38ead49aefb2659201d1e1a607ffda4a",
      "retrospective_sha256": "294faf4f1d65ad07da49757897469c73732cb0a758f4a7332af5e001c6d495b3",
      "actual_byte_range": {
        "byte_start": 22637,
        "byte_end": 25696
      }
    },
    {
      "scene_id": "SCN-09",
      "first_global_segment_index": 19,
      "last_global_segment_index": 20,
      "heading_sha256": "8922cbfa7da1790b999ced907c47be39e1c38913383d8b21cd4f344118d59ded",
      "situation_context_sha256": "15d637d8acc28139e2fb42525763f14bcccf0307fbc9ccd91fe7914492f85717",
      "sound_action_context_sha256": "52e20801701897a32a8997ce6fde12c4ee72314a97cc0ab6a2852f1f3e360d2e",
      "retrospective_sha256": "2cd36741985c774509d841b3010726a634e7338a1a292e7e8dffe4f39e55a72d",
      "actual_byte_range": {
        "byte_start": 25698,
        "byte_end": 28677
      }
    },
    {
      "scene_id": "SCN-10",
      "first_global_segment_index": 21,
      "last_global_segment_index": 21,
      "heading_sha256": "34697c3bcb51a3f62d154e97114be32642620c3ac14de4da72f31d7d531a0708",
      "situation_context_sha256": "1c1d3802e7c73e277a688dfe80d5a3e31db42b11f447f5a31d5b2adbcb4c4394",
      "sound_action_context_sha256": "8d6bafa60c01c1becb91df757f2eb7593bc8def0d4a9e2f355c1c7fd3a65f508",
      "retrospective_sha256": "addedc6fcb02cc504fd223ab5bf1660b279ddf5c232e428601d0dde54ccb6b6f",
      "actual_byte_range": {
        "byte_start": 28679,
        "byte_end": 31645
      }
    },
    {
      "scene_id": "SCN-11",
      "first_global_segment_index": 22,
      "last_global_segment_index": 22,
      "heading_sha256": "38a1fdb03e0660fcb202de4d46a6ea55431271a18321ef5d9cc4ff6cdd25a235",
      "situation_context_sha256": "e20e0ef506d75b0543e0a385e887a51dfa7247c37da3c52081aa7e347d0973c1",
      "sound_action_context_sha256": "f86bbe528128059936c89df7288401d477e578d4c1c8510d1628c438ee2b9e99",
      "retrospective_sha256": "2e0541438e54310ee0d06eec45d09b05585abe25fe9ce6052815016197acd1ab",
      "actual_byte_range": {
        "byte_start": 31647,
        "byte_end": 34414
      }
    }
  ],
  "segment_mappings": [
    {
      "segment_id": "SEG-001",
      "type": "DRAMA",
      "global_presentation_index": 0,
      "scene_id": "SCN-01",
      "actual_byte_range": {
        "byte_start": 3716,
        "byte_end": 4786
      }
    },
    {
      "segment_id": "SEG-002",
      "type": "NARRATION",
      "global_presentation_index": 1,
      "scene_id": "SCN-01",
      "actual_byte_range": {
        "byte_start": 4788,
        "byte_end": 5191
      }
    },
    {
      "segment_id": "SEG-003",
      "type": "PANEL_REACTION",
      "global_presentation_index": 2,
      "scene_id": "SCN-01",
      "actual_byte_range": {
        "byte_start": 5214,
        "byte_end": 5674
      }
    },
    {
      "segment_id": "SEG-004",
      "type": "DRAMA",
      "global_presentation_index": 3,
      "scene_id": "SCN-02",
      "actual_byte_range": {
        "byte_start": 6685,
        "byte_end": 7777
      }
    },
    {
      "segment_id": "SEG-005",
      "type": "NARRATION",
      "global_presentation_index": 4,
      "scene_id": "SCN-02",
      "actual_byte_range": {
        "byte_start": 7779,
        "byte_end": 8197
      }
    },
    {
      "segment_id": "SEG-006",
      "type": "DRAMA",
      "global_presentation_index": 5,
      "scene_id": "SCN-03",
      "actual_byte_range": {
        "byte_start": 9103,
        "byte_end": 10104
      }
    },
    {
      "segment_id": "SEG-007",
      "type": "PANEL_REACTION",
      "global_presentation_index": 6,
      "scene_id": "SCN-03",